{
  "schema_version": "1.0.0",
  "content_id": "FL-TEST-C",
  "brief_sha256": "895104622e68b60c17ff5d4e5fccc9635bbcc4c39f33491638cb4618fa90094a",
  "draft_sha256": "d0a261c9e017b572f1d43b6cb7f8e068a45fcb7d8ab8353243843b8d5e4349e0",
  "seo_policy_version": "seo-policy-0.1.0-draft",
  "artifact_ids": [
    "FL-TEST-C-brief",
    "FL-TEST-C-draft",
    "FL-TEST-C-claims"
  ],
  "stages": [
    {
      "agent": "A29",
      "status": "contract_pending"
    },
    {
      "agent": "A32",
      "status": "contract_pending"
    },
    {
      "agent": "A28",
      "status": "contract_pending"
    }
  ],
  "findings": [
    "A29相当モデル確認: 仮例・編集提案の表示と成果非保証を全文確認。主張候補は人間の最終確認対象。",
    "A32相当モデル確認: Search Intent、日本語、段落、具体性、区分差をSelf Reviewと別の比較レポートへ記録。",
    "A28相当構造確認: Brief/Draft hash、policy版、metadataと未解決の公開blockerを照合。"
  ],
  "blockers": [
    "QA agent implementations are absent",
    "Human article approval is absent",
    "Operational SEO policy and A06 acceptance require verification"
  ],
  "human_approval": null,
  "wordpress_handoff_allowed": false,
  "publication_allowed": false
}
