{
  "schema_version": "1.0.0",
  "content_id": "FL-TEST-B",
  "brief_sha256": "fd3c75562ea15d0183ad355a66375099566461e8b175314696c7706c080ff8cf",
  "draft_sha256": "d347a2a01d0210b44b7078946fb17a8dceb70180562b9a97f069c2cf3d506830",
  "seo_policy_version": "seo-policy-0.1.0-draft",
  "artifact_ids": [
    "FL-TEST-B-brief",
    "FL-TEST-B-draft",
    "FL-TEST-B-claims"
  ],
  "stages": [
    {
      "agent": "A29",
      "status": "contract_pending"
    },
    {
      "agent": "A32",
      "status": "contract_pending"
    },
    {
      "agent": "A28",
      "status": "contract_pending"
    }
  ],
  "findings": [
    "A29相当モデル確認: 仮例・編集提案の表示と成果非保証を全文確認。主張候補は人間の最終確認対象。",
    "A32相当モデル確認: Search Intent、日本語、段落、具体性、区分差をSelf Reviewと別の比較レポートへ記録。",
    "A28相当構造確認: Brief/Draft hash、policy版、metadataと未解決の公開blockerを照合。"
  ],
  "blockers": [
    "QA agent implementations are absent",
    "Human article approval is absent",
    "Operational SEO policy and A06 acceptance require verification"
  ],
  "human_approval": null,
  "wordpress_handoff_allowed": false,
  "publication_allowed": false
}
